Season,Episode,Scene,Character,Line
0,139,59,CARTER,What do you mean?
0,139,59,FELGER,"Well, Avenger's resistant to that type of tampering, you know? And I didn't think it made much difference since S-117 was sabotaged in the first place."
0,139,59,CARTER,"Jay, what if the virus replicated itself and then traveled along with the new coordinate system to the other DHDs?"
0,139,59,FELGER,"No, that's impossible. It wasn't designed to do that."
0,139,59,CARTER,"Well, it wasn't designed to trigger a correlative update, either. You said it yourself, Jay. The DHD program is adaptive."
0,139,60,CARTER,"Sir, we think we may have found a solution."
0,139,60,HAMMOND,Let's hear it.
0,139,61,FELGER,Y-you want me to tell it?
0,139,61,CARTER,It's your project.
0,139,62,FELGER,"Well, General, we think we know why we were unable to upload a dialing program into the 'gate system. It now looks as though the virus itself, somehow, transmitted along with the new coordinate system to the entire DHD network."
0,139,62,HAMMOND,The virus is blocking the upload.
0,139,62,FELGER,"That's right. That's right and we need to neutralize it first. But in order to do that, we have to find it."
0,139,62,HAMMOND,I don't understand.
0,139,62,FELGER,"W-w-well, uh, the truth is, uh, we don't know how the virus was transmitted. If it piggybacked with the automatic correlative update, that means it's buried somewhere within the dialing program itself. We're talking thousands of lines of code...you know, it would be like looking for a needle in a haystack."
0,139,62,CARTER,"But we do know that the virus exists within a very specific sub-routine of the original target DHD on P5S-117. The catch is, in order to make this work, we have to reboot the system which means removing the control crystal. Someone's going to have to physically go to the planet, sir."
0,139,62,HAMMOND,
0,139,62,CARTER,"Yes, sir."
0,139,62,FELGER,General... I'd like to volunteer.
0,139,62,HAMMOND,Major Carter has the experience required for this mission.
0,139,62,FELGER,"Oh, come on...I've got off-world experience. I battled the Goa'uld. I zatted a Jaffa."
0,139,62,CARTER,"Sir, maybe it would be better if we both went."
0,139,62,FELGER,Major Carter's right. Nobody knows more about Avenger than me.
0,139,63,CHLOE,"Jay, this is crazy."
0,139,63,FELGER,"Look, I caused this problem, I'm gonna fix it."
0,139,63,CHLOE,"You're a research scientist, not a field operative."
0,139,63,FELGER,"Did that stop me from infiltrating a Goa'uld mothership? I think not. Look, they've already sent the MALP. The 'gates not even being guarded. Probably, because it doesn't work any more, but don't worry about me."
0,139,64,FELGER,"I know what I'm doing, okay?"
0,139,65,CHLOE,Jay... ...the anti-virus.
0,139,65,FELGER,"Okay, yeah...yeah, yeah, I'm gonna need that. Alrighty."
0,139,66,FELGER,What?
0,139,67,FELGER,What...what was that for?
0,139,67,CHLOE,Good luck.
0,139,67,FELGER,Oh...right.
0,139,69,CARTER,"All right, you get set up. I'll be back in a few minutes."
0,139,69,FELGER,Where're you going?
0,139,69,CARTER,I'm gonna to check out the area.
0,139,69,FELGER,"Shouldn't we stick together? You know, in case you need back up or something?"
0,139,69,CARTER,I'll be fine.
0,139,69,FELGER,Okay...I'm good too.
0,139,71,O'NEILL,The Jaffa landed the Alkesh and they're sending out search patrols. Teal'c and I have organized the rebels for a counter attack.
0,139,71,HAMMOND,"Be advised, Colonel. Major Carter has gone to P5S-117. She's attempting to get the 'gate system back on line."
0,139,71,O'NEILL,"That's occupied territory, sir."
0,139,71,HAMMOND,"Yes, it is."
0,139,71,O'NEILL,What team did she take?
0,139,71,HAMMOND,Major Carter didn't want to risk stranding anyone else.
0,139,71,O'NEILL,She went alone?
0,139,71,HAMMOND,Not entirely...Dr. Felger's with her.
0,139,71,O'NEILL,I'm inspired with confidence.
0,139,72,CARTER,There's no sign of any Jaffa activity in the area.
0,139,72,FELGER,"I'm in. I'm in. Whoo... Just a sec, just a sec...okay...something's wrong."
0,139,72,CARTER,What?
0,139,72,FELGER,"This isn't Avenger. I mean, it's Avenger, but s-something's hinky. It's been altered."
0,139,72,CARTER,Hinky?
0,139,72,FELGER,"The point is, this isn't the program I wrote. I-it's been tampered with since it was sent."
0,139,72,CARTER,Maybe it was Ba'al.
0,139,72,FELGER,Ba'al?
0,139,72,CARTER,"Think about it. He stood the most to gain. He took your idea your idea to bring down one 'gate and modified it to bring down the entire 'gate network, knowing it would give him an advantage."
0,139,72,FELGER,"Huh...well, that means none of this was my fault. I told you Avenger wasn't designed to cause a correlative update."
0,139,72,CARTER,I wouldn't get too excited. It also means our anti-virus isn't going to work.
0,139,72,FELGER,That's right. It's designed for the original program.
0,139,72,CARTER,Which means that we are now stranded on a Goa'uld occupied world.
0,139,72,FELGER,So it's kind of a good news-bad news situation...
0,139,73,CARTER,"The Jaffa probably aren't as protective of the 'gate as they once were, but sooner or later, there's going to be a patrol. We have to do something."
0,139,73,FELGER,"Well, I'm open to suggestions..."
0,139,73,CARTER,"You said the virus was modified, right? So all we need to do is modify the anti-virus to match it."
0,139,73,FELGER,"Okay, go for it."
0,139,74,CARTER,I was hoping you could handle it.
0,139,75,FELGER,"Oh, I was afraid you were going to say that."
0,139,75,CARTER,You wanna do this instead?
0,139,75,FELGER,Do you know how many variations I went through before I got the anti-virus right? And that was when I knew what I was up against. This could take days.
0,139,75,CARTER,"Well, then you'd better get started."
0,139,75,FELGER,"Yep...oh, yeah..."
0,139,76,JACKSON,Still no word from Sam?
0,139,76,HAMMOND,To be honest...we should've heard back by now.
0,139,76,JACKSON,"Well, we're gonna have to abandon the Stargate and move to higher ground."
0,139,76,HAMMOND,"Very well. Good luck, Dr. Jackson."
0,139,77,CARTER,How's it coming?
0,139,77,FELGER,"We're getting there. It's pretty cool, isn't it? You and I working together? We're sort of like the intellectual Butch and Sundance of the SGC."
0,139,77,CARTER,Butch and Sundance got cornered and killed by the Bolivian army.
0,139,77,FELGER,"Yeah...that's a good point, yeah."
0,139,78,FELGER,What? What? What? What?
0,139,78,CARTER,We got trouble.
0,139,78,FELGER,Wh-what kind of trouble? What?
0,139,78,CARTER,Think Bolivia.
0,139,78,FELGER,Ah...Jaffa.
0,139,79,CARTER,They've made our position. Keep working.
0,139,80,FELGER,Oh...
0,139,81,FELGER,"Concentrate, Jay...concentrate. Just background noise."
0,139,82,CARTER,How's it coming?
0,139,82,FELGER,I'm feeling a little rushed. There's not enough time. There's not enough time.
0,139,83,FELGER,Whoa. Whoa. Whoa. Whoa
0,139,84,FELGER,"O'Neill. Look, it's Colonel O'Neill! Thank God! Oh, Colonel O'Neill, you wouldn't believe, you would not...thank God it's you..."
0,139,84,O'NEILL,Felger...Felger. Felger! What did I say about touching?
0,139,84,FELGER,"Absolutely, absolutely, it's just that we were over there, you know, and then they came...everywhere...and th-those guys...then you...over there... ...but now you're here. Now you're here. Nice one."
0,139,84,CARTER,"How'd you manage this one, sir?"
0,139,84,O'NEILL,We got tired of waiting.
0,139,86,HAMMOND,"Major, Doctor, welcome back."
0,139,86,CARTER,Sir.
0,139,86,HAMMOND,I trust the solution you came up with is of a permanent nature?
0,139,86,FELGER,"Oh, yes, yes...not to worry, General. I've modified the anti-virus, you know, specifically to target and neutralize the altered version of Avenger. But I've also added a little patch, you know, just to ensure that no one will ever..."
0,139,86,CARTER,"The problem is solved, sir...permanently."
0,139,86,HAMMOND,Dr. Jackson managed to get the remaining inhabitants of 997 through to the Alpha Site.
0,139,86,CARTER,"Good to hear it, sir."
0,139,86,HAMMOND,What about Colonel O'Neill and Teal'c?
0,139,86,CARTER,They found an alternate means of transport. I promised the Colonel I wouldn't say anything...want's it to be a surprise.
0,139,88,CHLOE,I was so worried about you.
0,139,88,FELGER,It was no big deal.
0,139,89,FELGER,"Not a chance, Baby."
0,139,90,CARTER,What is this?
0,139,90,FELGER,"Oh... Hi, guys. I know, we're not really supposed to be...fraternizing, but, hey..."
0,139,90,CARTER,I turn my back for two seconds and you take up with this...trollop?
0,139,90,FELGER,Oooh... He puts his hands up as Chloe begins moving toward Sam.
0,139,90,CHLOE,Don't blame me just because you were never woman enough to satisfy him.
0,139,90,CARTER,Ohhh... That's it.
0,139,91,FELGER,"Whoa...ladies, please, no this isn't really necessary..."
0,139,91,O'NEILL,Shhhh! Don't talk.
0,139,92,CHLOE,Jay...Jay? Jay...
0,139,92,FELGER,What? What?
0,139,92,CHLOE,What were you thinking about?
0,139,92,FELGER,Nothing.
