Season,Episode,Scene,Character,Line
0,178,48,JACKSON,I don't know.
0,178,48,VALA,What are you gonna do about it?
0,178,48,JACKSON,*quiet Angry* shut up.
0,178,48,CARTER,That was a multi gigatonne detonation. There's just no way.
0,178,48,JACKSON,Maybe the gate was destroyed.
0,178,48,MITCHELL,"No. If the field is still expanding, the gate still has to be active."
0,178,48,CARTER,The environment inside the field has been turned into super heated plasma. Makes it impossible to get a reliable reading.
0,178,49,GERAK,And this is your message to the Ori?
0,178,49,VALA,"Pithy, wasn't it?"
0,178,49,TEALC,We struck the enemy with our most powerful weapon.
0,178,49,GERAK,And yet their force field grows.
0,178,49,TEALC,That was not our intention.
0,178,49,GERAK,"The beachhead must be destroyed. If you are truly our ally, you will join us in this attack. If you do not, your ship will become our next target."
0,178,50,PENDERGAST,The detonation did weaken the force field... Our combined weapons fire might just finish the job.
0,178,50,TEALC,"If it does not, we will soon be engaged in battle with Gerak's forces."
0,178,50,CARTER,We just don't have enough information. Until I can explain how they're keeping the gate open or powering a force field this large. *to Mitchell* It's your call.
0,178,50,VALA,*raises hand* I say we run away and rethink the whole thing.
0,178,50,MITCHELL,*walks round* Open up with everything we've got.
0,178,50,PENDERGAST,Bring the main rail gun online. Commence firing. Launch missiles
0,178,51,PENDERGAST,Is the fire having any effect?
0,178,51,MARKS,Force field is definitely strength.
0,178,51,CARTER,But it's still expanding at a faster rate than it's weakening.
0,178,51,JACKSON,It's almost enveloped the entire planet. What happens then?
0,178,51,CARTER,*after a minute* Dammit!
0,178,51,VALA,What?
0,178,51,JACKSON,What?
0,178,51,CARTER,"*to Mitchell* Colonel, we need to cease fire now!"
0,178,51,MITCHELL,*to Pendergast* Now!
0,178,51,PENDERGAST,*to Marks* Do it!
0,178,51,CARTER,The greater the intensity of our weapons fire... the greater and more frequent their expansion phase is... There is a direct correlation. They're using the energy of our own weapons to build their beachhead.
0,178,51,VALA,You mean they planned this? *looks at Daniel in an I told you so way*
0,178,51,CARTER,"There's no way to project the necessary power through a Stargate, across galaxies. So they designed a force field that could be powered by our own weapons."
0,178,51,TEALC,The Ori knew the Jaffa on Kalana would defend their home world and others would follow.
0,178,51,JACKSON,And Nerous made certain we'd join in.
0,178,51,MITCHELL,Which means he's working for the Ori.
0,178,51,CARTER,The mark nine gave them almost 70% of the power they needed to envelop the entire planet.
0,178,51,MITCHELL,"Oh yeah, we've been set up."
0,178,51,VALA,"*sarcastic* What a complete shock! *Jackson looks at her, she nods, making a zipping motion* won't say another word."
0,178,51,TEALC,Gerak's forces must also cease fire.
0,178,51,PENDERGAST,Open communications.
0,178,51,JACKSON,Too late.
0,178,52,CARTER,*beeping sounds* I'm reading activity on the surface.
0,178,53,CARTER,We've got incoming. Three objects and counting. Bearing 180. Rising from the planet's surface from the coordinates of the Stargate and accelerating.
0,178,53,PENDERGAST,Shields to maximum
0,178,54,GERAK,Why have you ceased fire?
0,178,54,TEALC,We have reason to believe our weapons may power the enemy force field.
0,178,54,GERAK,Impossible!
0,178,54,CARTER,"that's what I thought, but it's the only explanation."
0,178,54,JACKSON,"Gerak, they used both of us!"
0,178,54,MARKS,"Multiple contacts on multiple bearings, sir."
0,178,54,MITCHELL,What the hell are they?
0,178,54,CARTER,"They are about ten meters long. But sensors read no internal space, no life signs aboard."
0,178,54,PENDERGAST,rail guns to defensive fire mode! Stand by launch fighters.
0,178,54,MARKS,One of them is on a collision course.
0,178,54,CARTER,I can confirm that. 1000 meters... 500.
0,178,54,PENDERGAST,Sub-light engines to emergency thrust. Brace for impact!
0,178,55,WOMAN,*in background* Thermal levels rising
0,178,55,PENDERGAST,Damage report!
0,178,55,MARKS,There's a hull breach on the hangar deck. Shields are down to 20%.
0,178,55,PENDERGAST,Return fire. All positions.
0,178,55,CARTER,Sensors are down.
0,178,55,PENDERGAST,Take us out of orbit...... We can't stay here.
0,178,56,LANDRY,I wanna know what you sent my people into.
0,178,56,NEROUS,"General, I've been expecting you... You know...*waves egg* These eggs, they're not properly ripe. *moves to eat it, Landry knocking it out of his hand*"
0,178,56,LANDRY,I asked you a question! Sergeant! *SFs point weapons at Nerous*
0,178,56,NEROUS,"Oh. They say all good meals come to an end...... I assume, General, that by now, SG1 has reported that the Ori, the closest thing to true God's in the entire universe, have successfully established a permanent foothold."
0,178,56,LANDRY,What did you do?
0,178,56,NEROUS,"Oh, it's not what I did. General. What I have done pales in comparison to your contribution. And by now... the force field has almost entirely enveloped the planet. Which makes them unstoppable. *Goauld voice* And we couldnt have done it without you."
0,178,57,GERAK,Two of my ships have been destroyed and my own flagship has been damaged. We must withdraw.
0,178,57,TEALC,"We too have suffered damage, Gerak, but the battle is not yet over."
0,178,57,GERAK,"Our sensors tell us that the planet has begun to collapse. I cannot tell you to what extent. If you choose to remain to find out, know... that your actions... will be watched."
0,178,57,JACKSON,Hey! We're on the same side here!
0,178,57,GERAK,We... shall... see.
0,178,58,MITCHELL,What is he talking about?
0,178,58,VALA,Hes leaving.
0,178,58,CARTER,"We've got the sensors back up, but we're gonna have to get closer to the planet to find out."
0,178,58,PENDERGAST,"Right, bring us about. Take us back into the system."
0,178,58,CARTER,"Ok, I've got a fix on the planet. Looks like Gerak was right. According to the sensors, it's diameter has decreased by 16%."
0,178,58,VALA,"Planet's don't shrink, in my experience."
0,178,59,CARTER,"Ah, there's something else. *Jackson and Mitchell flank her sides*"
0,178,59,MITCHELL,What is that?
0,178,59,JACKSON,A ship?
0,178,59,CARTER,"It's hard to say. Whatever it is, I think it's composed of the objects that came through the Stargate."
0,178,60,JACKSON,Doesn't that look an awful lot like a...uh...
0,178,60,MITCHELL,"Yeah, it does."
0,178,60,CARTER,"In fact, I think that's just what it is."
0,178,60,JACKSON,"No, it can't be, cause I was gonna say, Stargate."
0,178,60,CARTER,Try supergate. I estimate it's about 3 to 400 meters across.
0,178,60,TEALC,Large enough a passage of their entire Armada.
0,178,60,VALA,*walks over to Marks side* It's incomplete. There's still time.
0,178,60,JACKSON,Time? Time to do what? everything we've done has just made things worse.
0,178,60,MARKS,The planet's diameter has now decreased by up to 50% and it's accelerating rapidly.
0,178,60,CARTER,I think I know why. Only one thing in the universe could power a gate that size. It's also the only thing that could allow them to keep the gate open this long. And there's one on the other end.
0,178,60,JACKSON,A black hole.
0,178,60,CARTER,"That's what the force field was for. It wasn't meant to keep us out, it was designed to collapse the planet into one micro singularity."
0,178,60,MITCHELL,Why?
0,178,60,CARTER,"Well, this is how they can create a wormhole that can span such a vast distance. With a black hole at either end they can maintain an open wormhole indefinitely."
0,178,60,MITCHELL,"uh... Fine, fine. How do we stop it?"
0,178,60,VALA,I have an idea. If we could *points* put---
0,178,60,JACKSON,"The next idea that anybody comes up with, has to be outside the box! *Vala clamping on her temper*"
0,178,60,CARTER,"Ok, the gate is composed of individual units. Uh...uh...There must be some kind of energy linkage between them. Like uh... like a chain."
0,178,60,VALA,Exactly! So we...
0,178,60,MITCHELL,So we need a big ole set of bolt cutters. *Vala gives up*
0,178,60,JACKSON,Oooh! Too far outside the box. Get closer to the box!
0,178,61,CARTER,"Planetary collapse is speeding up exponentially. I estimate singularity formation is minutes away and there will be a significant shockwave. Whatever we're gonna do, we have to do it now."
0,178,61,MARKS,Sir? Someone has just activated the ring transporter.
0,178,61,PENDERGAST,What?
0,178,61,JACKSON,"*looks round, registering Valas absence* Oh no."
0,178,62,VALA,Hey! Don't leave without me.
0,178,62,JACKSON,Vala! Where the hell are you?
0,178,62,VALA,"Oh, you care now!"
0,178,62,JACKSON,Vala!
0,178,62,VALA,I'm aboard the cloaked cargo ship that Gerak left behind to watch us.
0,178,62,JACKSON,How did you find it?
0,178,62,VALA,"Good guess? Look, the tones are set a certain way. Rings seek out the nearest set, which happen to be aboard this cargo ship, cloaked or not. *pokes at various buttons*"
0,178,62,JACKSON,What are you doing?
0,178,62,VALA,"Trying to help, Daniel. Someone had to do something and you wouldn't listen. Actually, I got the idea from Colonel Carter. The objects are being held in some sort of energy field like links in a chain and I intend to take the place of the last link."
0,178,62,CARTER,"Vala, when that singularity forms, there will be a powerful shockwave. The cargo ship won't survive."
0,178,62,VALA,I'm counting on it. I'll ring back before it hits. Then you can all thank me immensely.
0,178,63,PENDERGAST,Shields to maximum.
0,178,63,CARTER,She's running out of time.
0,178,64,VALA,Alright.
0,178,65,CARTER,It's working. She disrupted the energy field holding the objects in place. *Shot of objects* The singularity is forming. *Planet shrinks*
0,178,67,CARTER,She did it. The gate's been destroyed.
0,178,67,JACKSON,*staring* Did Vala make it back onboard?
0,178,67,MARKS,Negative sir.
0,178,68,MITCHELL,Jackson! Infirmary
0,178,68,CARTER,Get a message to Stargate Command. The Ori beachhead has been destroyed.
0,178,69,NEROUS,"There's still time to repent, General. The Ori are forgiving."
0,178,69,LANDRY,That won't be necessary. SG1 has destroyed the Ori beachhead.
0,178,69,NEROUS,*laughs* You're lying.
0,178,69,LANDRY,I'm not.
0,178,69,NEROUS,"Ive witnessed their power, General. Power that will one day be mine. And if what you say is true, you have merely forestalled the inevitable... And... when you put me to death for what I have done, I shall ascend."
0,178,69,LANDRY,...you will descend to a small dark room in the basement of Area 51 and you'll stay there till you come up with a defense against the Ori. That was our deal.
0,178,69,NEROUS,"*frowns, laughs* what would possibly compel me to do that?"
0,178,69,LANDRY,Hunger. *takes the smile right off nerous face. They all leave*
0,178,70,MITCHELL,"You know, these Ori are just going to try it again."
0,178,70,CARTER,Probably.
0,178,70,MITCHELL,"Sam, we could sure use someone like you on the front line. Just think about it. *he heads off ahead*"
0,178,70,MITCHELL,"Hey, Jackson!"
0,178,70,JACKSON,"*wakes* Sorry, I keep falling asleep."
0,178,70,CARTER,"Well, it's better than the alternative."
0,178,70,CARTER,You're lucky the bracelet's affect was wearing off.
0,178,70,JACKSON,"Yeah, lucky me."
0,178,70,TEALC,Vala Maldorran will be mourned.
0,178,70,CARTER,I've been going over the telemetry from the last few seconds before the formation of the singularity. A matter stream left the cargo ship just before it exploded. I mean... There's at least a slight chance that it was pulled into the singularity.
0,178,70,JACKSON,"So you're saying she could be alive, somewhere in the Ori home galaxy."
0,178,70,CARTER,It's possible.
0,178,70,JACKSON,*looking hopeful* Well...We wanted to send them a message.
