Season,Episode,Scene,Character,Line
0,177,0,STARGATE SG1,Episode 905
0,177,0,"""THE POWERS THAT BE""",By Martin Gero
0,177,1,VALA,What are you doing here?
0,177,1,MITCHELL,Having lunch. *Eats*
0,177,1,VALA,Don't you care that there could be priors out there taking advantage of poor. Innocent. People. *he's reading some other file* Luring them into an Oppressive religion or worse...Killing them for rejecting it.
0,177,1,MITCHELL,Are you bored of bothering Jackson?
0,177,1,VALA,"Hey. You're supposed to be going out on missions through the Stargate. So let's go. Let's rid the galaxy of evil doers. *when he doesn't answer* Look despite what Daniel might think I really can help...*h obviously doesn't believe her* I know how things work out there. I'm physically capable, I'm good with weapons...Not to mention *louder* seductively attractive *two airman behind her turn to look, she laughs and waves* make a fine asset to any SG team."
0,177,1,MITCHELL,You left out selfish and untrustworthy. *eats*
0,177,1,VALA,"How about independent and *grins opening file, waves at it* resourceful."
0,177,1,MITCHELL,*quietly* that is a classified file. *definitely not happy*
0,177,1,VALA,*turns pages pointing* Priors have been reported on forty three different planets already.
0,177,1,MITCHELL,Yeah that's what the file says.
0,177,1,VALA,Well it just so happens that I have a very good relationship with the people on the one you've designated *reads*
0,177,1,MITCHELL,"*turns to her* Define... ""Relationship"""
0,177,1,VALA,"They trust me. *Mitchell nods, gets up.* what? Where are you going?"
0,177,1,MITCHELL,*heads for door* I'm going to go Talk to Landry
0,177,1,VALA,"Why? *makes a face, worried, makes fists with her hands*"
0,177,1,MITCHELL,*Comes back taking file* because anyone who trusts you...is obviously in a great deal of danger.
0,177,3,VALA,Oh good...no one's here.
0,177,3,MITCHELL,I thought these people trusted you...why are we sneaking around? Avoiding everybody?
0,177,3,VALA,"I already told you, they won't recognize me dressed like this. Fortunately I left a couple of spare outfits behind. *Heads for a side room*"
0,177,3,MITCHELL,What is it with her and her wardrobe?
0,177,3,JACKSON,*follows her* Look I think we could probably explain to them exactly
0,177,3,VALA,"*stops, turning to him* It'll only take a second. *stops him* can a Girl have a little privacy?"
0,177,3,JACKSON,No. Besides I think I've seen just about everything there is to see.
0,177,3,VALA,"*grins, Jackson really not liking the look she's giving him* right. *after a minute* Look there's no other way out of this room. I'm just going to change. Be right back. *she heads off*"
0,177,4,MITCHELL,Hey *waves*
0,177,5,AZDAK,These are the weapons of our God Qetesh! Who are you?
0,177,5,MITCHELL,Just take it easy
0,177,5,AZDAK,What are you doing here?
0,177,5,JACKSON,"*walks forward, hands raised* we mean no harm."
0,177,6,AZDAK,Please. Forgive us. It has been so long we began to fear you would not return.
0,177,7,VALA,Then you are foolish. I would not abandon you. I am your God.
0,177,8,CREDITS,
0,177,9,MALE1,I have pillaged the galaxy many times over. And made slaves of all the mortals I have encountered. This world pleases me and I shall take it as my own.
0,177,9,MALE2,"The benevolent god, Qetesh, will never allow such treachery."
0,177,9,JACKSON,*whispers to Mitchell* Not exactly Shakespeare
0,177,9,MALE1,----slave I am Ba'al---
0,177,9,MITCHELL,*whispers* How is it these people don't know the Goa'uld have fallen?
0,177,9,JACKSON,Most of these worlds are pretty isolated and I would be very surprised if anyone here actually knew how to operate the Gate.
0,177,9,TEAL'C,These humans must be told the truth.
0,177,9,JACKSON,I know. *looks at Vala*
0,177,9,MALE2,*a woman now stands by him* Oh merciful. Beautiful Qetesh. Have mercy on him...he knows not your power.
0,177,9,JACKSON,"*Walks up to Vala, whispers* What are you doing?"
0,177,9,VALA,It's a play. Don't worry...I think it will be over soon. Then we will eat.
0,177,9,JACKSON,That's not what I'm talking about.
0,177,9,VALA,"We want to stop these people from falling victim to the priors, that's what I'm going to do."
0,177,9,JACKSON,This is not what I had in mind.
0,177,9,VALA,"What your mind may or may not be able to imagine is really none of my concern. Now kindly get out of your God's face. *He gives her a look, she glances at him and he heads back to Mitchell and Teal'c*"
0,177,9,MALE2,---You have never met the likes of Qetesh
0,177,9,WOMAN,No man shall lay claim to my world. And no man shall bring harm to my children. Rises hand over Male1*
0,177,10,MALE2,Thanks be to you Qetesh. All hail and Glory be to you.
0,177,11,VALA,hmm...
0,177,11,AZDAK,"*stands* we had little rehearsal my lord, but I trust it pleases you?"
0,177,11,VALA,"Yes *Azdak grins* as always Azdak, you please your God greatly."
0,177,11,AZDAK,Thank you my lord. You have been greatly missed.
0,177,11,VALA,"*grins* Now. I would like to hear about the visitor who arrived through the Chappa'ai *After a lot of whispering* It is pointless lying to your God, Azdak, I am all knowing as well as all Beautiful *Mitchell and Jackson give her a look*"
0,177,11,AZDAK,He said that he was here to save us. That our true Gods await our devotion
0,177,11,VALA,Lies. *nods* meant to deceive you.
0,177,11,AZDAK,
0,177,11,VALA,"Some of you did,"
0,177,11,AZDAK,You have been absent for so many seasons. Some had thought you had abandoned us. They were weak my lord. Please...forgive them?
0,177,11,VALA,Have I not always been merciful to those who deserve forgiveness? *he nods* Now go while I consider your punishment.
0,177,11,AZDAK,Yes. Of course *bowing as he and the others leave*
0,177,11,VALA,*once they've all gone * Well that was easy. *stands stretching*
0,177,11,JACKSON,Shut that thing off.
0,177,11,VALA,mmm *hits a button*
0,177,11,TEAL'C,Why must you continue to deceive these people?
0,177,11,VALA,This was one of the many planets that Qetesh ruled over when I was her host. *more stretching* as you know a Tok'ra eventually removed the symbiote but not before her people rebelled and tortured me thinking we were one in the same.
0,177,11,MITCHELL,*stands* And they couldn't tell the difference? *mutters to Jackson and Teal'c* Why am I not surprised?
0,177,11,VALA,I had nothing. I was desolate. *sits by Jackson* Fortunately I discovered that news of Qetesh's demise had not reached this little mining outpost.
0,177,11,JACKSON,
0,177,11,VALA,"Just a tiny bit. *Jackson Can't believe it* Nothe mine was practically barren by the time I got here but this planet acted as a safe haven for me until I got back on my feet. *Teal'c groans, turning away* Look I never killed anyone; I never tortured them I was a wonderful God. Just ask them."
0,177,11,JACKSON,I think we will *gets up*
0,177,11,VALA,*Jumps up following* why? You don't believe me?
0,177,11,JACKSON,*stops turning to her* That. And I'm not totally convinced they're gonna follow your command nor should that be the only reason they don't follow the priors. *starts to head off again*
0,177,11,VALA,*follows* I am still supposed to be there God *he stops* I can't exactly go out there and ask them is they're going to listen to me.
0,177,11,JACKSON,I wasn't expecting you to. *starts off again*
0,177,11,VALA,*follows* what makes you think they're going to tell you the truth *he stops getting a little wound up* you're suppose to be my faithful servants.
0,177,11,JACKSON,"Then I'll just have to explain that we're not as faithful as you might like to believe and if necessary I'll also tell them we're plotting to. Kill. you. *he heads off, she stares shocked*"
0,177,11,VALA,hu-I *shouts after him* I have heard better plans. MITCHELL: *walks up to her* I kind of like it.
0,177,11,VALA,Shut up *storms off to throne.*
0,177,12,LANDRY,How are the staff Evaluations coming?
0,177,12,LAM,*pulls off stethoscope putting them in her pocket* They're done. They'll be on your desk by tomorrow morning. that's when they're due right?
0,177,12,LANDRY,yes. *nods* I have uhLunch with uh...the heads of my departments once a month...just to stay in touch...uh get any housekeeping done...it helps me get to know them a lot better...I know in our case uh...
0,177,12,LAM,*she stops* what? *waits* in our case what?
0,177,12,LANDRY,"well...it's just that we know each other better that I say do... Colonel Garret, the ammunitions supply officer."
0,177,12,LAM,really? I actually doubt that. Colonel Garrets been here longer than I have.
0,177,12,LANDRY,"*glances at a passing airman, quieter* do we have to do this here?"
0,177,12,LAM,You wanna have lunch? Fine. Tomorrow noon...I will be there as ordered.
0,177,12,LANDRY,It's not an order.
0,177,12,LAM,ok. *walks off*
0,177,14,THATCHNAR,"I have been sick for some time now, the past few harvests I've been more of a burden than a help to my family. I had even lost the ability to stand."
0,177,14,JACKSON,You're standing now.
0,177,14,THATCHNER,The prior. He cured me. *some of the villagers look over* Said that it was the will of the Ori.
0,177,14,AZDAK,*rushes for him* Blasphemer. *Teal'c and Mitchell stop him*
0,177,14,MITCHELL,Just take it easy...
0,177,14,AZDAK,I'm sorry...but I will not have him speak against Qetesh like that in my presence.
0,177,14,JACKSON,Look we're not out to get anybody here...we just want to hear what he has to say. *to Thatchner* go ahead.
0,177,14,THATCHNER,The Jewel in his staff glowed *a crowd gathers listening* He waved it over me and I felt better than I ever have. All he asked in return was that I tell others. That I spread the word of the Ori. Then upon his return...
0,177,14,TEAL'C,When is this prior to return?
0,177,14,THATCHNER,Tomorrow. The prior said that Qetesh is a false God. That if she ever returned he would expose her weakness.
0,177,14,AZDAK,You're a fool. Speak no more or I'll shall strike you don' in the name of our true God. *goes to hit him*
0,177,14,MITCELL,*stops him* I said take it easy.
0,177,14,AZDAK,You should be thankful that Qetesh is so forgiving. And pray that when she slays the prior for his wicked lies. She won't do the same to you.
0,177,14,JACKSON,Oh boy.
0,177,14,AZDAK,Glory be to Qetesh!! Glory to the one true God! G-
0,177,14,MITCHELL,Ok...you have made your point. Know when to stop.
0,177,14,JACKSON,I think I need to talk to our one true god. *Mitchell nods*
0,177,15,JACKSON,This is why you wanted to come back to this planet?
0,177,16,VALA,All of this is mine. I earnt it. These people have just been keeping it safe for me. *Jackson not happy* and as you said we can't be 100 percent certain that they're going to obey me so if this planet does fall to the priors...
0,177,16,MITCHELL,Hello. *picks up some gold* You stealing this planets most valued treasure is the least of our concerns right now. *drops gold*
0,177,16,VALA,"I like your attitude *grins at him* I was thinking of cutting you boys in at 10% but now I'm thinking *grabs his nose, pulling it* 20"
0,177,16,TEAL'C,Despite your return many of the villagers believe the Ori to be true gods and worthy of their loyalty.
0,177,16,VALA,all the more reason why we should pack all of this up right now and get out of here. Are you gonna pitch in or what?
0,177,16,TEAL'C,Others believe you will slay the prior in a show of power upon his return tomorrow.
0,177,16,VALA,Tomorrow hmm...tomorrows no good for me.
0,177,16,JACKSON,You need to tell these people the truth.
0,177,16,VALA,I have a lot of needs Daniel but I assure you that is not on of them.
0,177,16,TEAL'C,"If you do not tell them the truth, we will"
0,177,16,VALA,Yes...and who do you think they're actually going to believe?
0,177,16,JACKSON,Look commanding these people to obey you and not the Ori is not going to work. Especially once that prior comes back.
0,177,16,MITCHELL,And we do not want to get into a God-Off. Especially since we know you're not even close.
0,177,16,VALA,Forget what I said about the 20%
0,177,16,JACKSON,Yes he's right we can't just trade one lie for another lie.
0,177,16,VALA,*turns to him* Alright...what can we fight with then? How can we stop this prior from corrupting these people?
0,177,16,JACKSON,ok...we have a very limited window of opportunity here. If you expose yourself as a false God... *She paces* if you tell these people how you fooled them and why...we might be able to make them skeptical about the prior.
0,177,16,VALA,*comes back* or it could push them to believing in the Ori as rue gods even more.
0,177,16,JACKSON,No. The only chance these people havethe only chance any of us have against the priors is to show them we will not accept the Ori as Gods. No matter what happens we must reject them. True enlightenment must begin with the truth.
0,177,16,VALA,Oh please...the truth is so overrated.
0,177,16,JACKSON,Look *steps forward grabbing her shoulders* for once just do the right thing here...ok? You're gonna feel so good about it afterwards. Trust me. *smiles*
0,177,17,JACKSON,really this...this is unnecessary.
0,177,17,AZDAK,"You will be executed first light tomorrow. Imposter *spits at her feet, leaves*"
0,177,17,VALA,"So...Daniel *motions him over with her head, he steps closer* when does that warm and glowy feeling from doing the right thing kick in...cause...not there yet. *forced smile*"
0,177,18,VALA,I can't believe you all just stood there *gets up on bench pulling top bars* and let them imprison me.
0,177,18,JACKSON,Well what were we suppose to do?
0,177,18,VALA,You have guns don't you?
0,177,18,JACKSON,There's like over 100 people there
0,177,18,VALA,and? *jumps down walking over to other side*
0,177,18,JACKSON,Well...Just relax...we're gonna get you out of this
0,177,18,VALA,"*walks back over, calmly* Oh you are...? I feel a lot better... I'm sorry I...I...I got a little nervous what with the whole *shouts* Execution looming and all."
0,177,18,JACKSON,Would you just...believe me...it's not gonna come to that. Mitchell and Teal'c are talking to them right now.
0,177,18,VALA,*walks over* Have you forgotten that if I die...you die?
0,177,18,JACKSON,"Believe me it is not gonna come to that. Trust me. *Vala Gasps, turns her back to him and sits.* this time"
0,177,19,MITCHELL,Fine she made a mistake. it was a big mistake. It was a whopper...but you can't just kill her.
0,177,19,AZDAK,Why not?
0,177,19,MITCHELL,"*quiet, then* a little help?"
0,177,19,TEAL'C,Does she not deserve a trial? To explain the things that she has done?
0,177,19,AZDAK,I think we all have a pretty good idea of what she did and why. *walks past Mitchell*
0,177,19,MITCHELL,*grabs him* Your people are looking for leadership. They are looking to you. So you've got to decide. What kind of society do you want to have? One where people get executed without having a chance to explain their actions?
0,177,19,AZDAK,*realizing* you want to hold a maldarran?
0,177,19,MITCHELL,*to Teal'c* ain't that her name? *holds hand up to Azdak*
0,177,19,AZDAK,Qetesh established a process several years ago. A way to settle disputes between two parties.
0,177,19,MITCHELL,Fine. That sounds...fitting we're gonna hold a Maldarran.
0,177,20,JACKSON,*spots Mitchell* hey. How'd it go?
0,177,20,MITCHELL,"well you know...*Vala can't do it, gets up.*"
0,177,20,VALA,"what's the plan? You gonna blow up this door, lay down suppression fire, so that we can...rush out through the hidden escape passage. *Jackson looks at her* It's in the room I told you had no other exit *he bashes his hand on the door*"
0,177,20,MITCHELL,They're going to pt you on trial tomorrow.
0,177,20,VALA,*thinking* I like my plan better.
0,177,20,MITCHELL,Kinda is your plan. It's named after you.
0,177,20,VALA,really? *excited* a Maldarran. *grins* they going to let me be the judge?
0,177,20,MITCHELL,Don't think so.
0,177,20,VALA,Then it's not a real maldarran is it?
0,177,20,JACKSON,Actually this couldn't have worked out better.
0,177,20,VALA,Actually I think it could have
0,177,20,JACKSON,No a trial is public. We can use the form to expose what it is to be a false god and warn the community about the priors
0,177,20,VALA,You're right actually. We could get them all worked up about false God's and then they can kill me as an example to the others.
0,177,20,MICHELL,Look...I persuaded them to let you stay here for the night...
0,177,20,JACKSON,right...thanks...
0,177,20,MITCHELL,"Yeah...*heads off, waving* well I'll see you guys in the mooring."
0,177,20,VALA,*shouts after him* Thth-Thank you! I apologize for ever doubting your masterful skills at negotiations.
0,177,20,JACKSON,He's doing the best he can.
0,177,20,VALA,Oooh. That's what terrifies me
0,177,21,AZDAK,"*Get up, walks to the centre...* Welcome and thank you all for coming...unlike in the past...the final decisions of ...this Maldarran will be yours, my friends. A general vote. After both presentations have been made we shall all decide what is to be done to the false God Qetesh"
0,177,21,VALA,*a lot of muttering by the crowd* we're pleading innocent right?
0,177,21,JACKSON,*disbelieving* You already confessed.
0,177,21,VALA,a girl can change her mind.
0,177,21,AZDAK,"*a villager hands him a scroll, he opens it up* we shall begin as always...with a reading of the claims. The first claim of seven. Mass murder."
0,177,21,VALA,uhm-- *turns to Jackson* Wait a second
0,177,21,AZDAK,The second claim of seven. Mass Torture.
0,177,21,VALA,"*to Jackson, whose nodding* I never killed...I never Tortured... that is Qetesh."
0,177,21,AZDAK,The third claim of seven
0,177,21,JACKSON,*stands* uh...excuse me...Hi...sorry to interrupt. Um...the person seated before you didn't do those things...*Vala waves*
0,177,21,AZDAK,You will have your chance to make your presentation.
0,177,21,JACKSON,yes...um...I'm...I'm sure we will. I just wanted to make something very clear as we discussed when she confessed...Vala was a host...to a Goa'uld...a parasite that controlled her actions for many years. It was that Goa'uld symbiote named Qetesh that committed the atrocities that you are talking about...Vala herself can only be held responsible for the actions she did after that Goa'uld was removed...
0,177,21,AZDAK,When exactly was that?
0,177,21,JACKSON,"Um...*looks at Vala, leans down so she can whisper in his ear* four ye---four years? *quieter* four years."
0,177,21,AZDAK,"*goes to whisper with his co-council, comes back* very well. Assuming your assertion to be true. We shall begin again. *Vala grins at Jackson, who seems happy they've let her off* the first claim of four. Planetary wide forced labor. *Jackson's face falls, looks at Vala, who nods*"
0,177,21,MITCHELL,*to Teal'c*...this is gonna be a long day.
0,177,21,TEAL'C,Indeed.
0,177,21,AZDAK,"I...perhaps more than any of you, feel great sorrow...at the fact that I devoted my love...and faith so freely to *turns to point at Vala*...an imposter, Who cared only for the naquadah in our mines. With every breath... she lied. With every effort... she stole. At every chance she betrayed us. The conditions of poverty that we now suffer... are her fault and her fault alone. That is what you must consider! *the crowd starts whispering*"
0,177,21,MITCHELL,*to Vala* he's good.
0,177,21,VALA,I'm dead.
0,177,21,JACKSON,*takes a deep breath stands*...yes. She stole. She betrayed you. She used you as slave labor. All this is true.
0,177,21,VALA,*Confused* not the opening statement I would have gone for.
0,177,21,MITCHELL,shhh
0,177,21,JACKSON,"but the only reason you know about this is because she told you. She came forward knowing full well how you would feel...what the consequences would be...ask yourselves...why would she do this? She did it because there is a greater threat in this galaxy she thought you deserved to know about. She told the truth in order to open your eyes...to show you the dangers of giving away your freedom, your freewill...in the hopes...that given another chance you wouldn't make that same mistake twice. *Vala holds her head higher* we know that a prior of the Ori has come here, he's been sent to this village to convince you to worship beings more powerful than all of us, but you must know...that like Vala they are not gods."
0,177,21,PRIOR,You speak well Daniel Jackson *Teal'c stands raising P-90* of the planet Earth. What is a god? What power is great enough to make you bow down in humble reverence *Jackson look at Vala*
0,177,21,VALA,*whispers to Mitchell* that's the one that tried to burn us to death. twice
0,177,21,PRIOR,There is only one measure. The only question you may ask yourself is why must I believe? What is there for any or all to gain by choosing the path of origin? Those seeking eternal salvation can follow the word of the Ori. Those that do not shall die as mortals. It is as simple as that. The day of reckoning approaches. *grins* your destiny awaits.
0,177,21,MITCHELL,He's pretty good too...
0,177,21,VALA,We are so dead.
0,177,22,THATCHNER,"*steps forward, dropping to his knees*I have told them of the Ori Prior. Many of us believe."
0,177,22,JACKSON,But not all of us.
0,177,22,PRIOR,You doubt the power of the Ori?
0,177,22,JACKSON,No. but I understand how they got it...and because I do I'm not willing to abandon my own freewill and worship them for it.
0,177,22,PRIOR,The Ori healed this man. This man that was sick. This man that could barely walk.
0,177,22,JACKSON,This man was healed through Knowledge. We have medicine. We have...tools that can do much the same thing. This device *picks up healing device from other table* has the power to heal...if you know how to use it. But not by power *holds it up* it's called technology.
0,177,22,PRIOR,Technology.
0,177,22,JACKSON,yes. Knowledge. Understanding. Of the way things work. Of the science... of the universe.
0,177,22,PRIOR,Maybe so...but consider this. There are two men. One is starving and the other has a plentiful crop. Is it not wrong...for the fortunate man to hoard his harvest? *the crowd whispers* should he not share with his hungry brother? It is the same with knowledge and understanding...as you have said the Ori have a greater understanding of the universe but most importantly they are willing to share it with us. Out of their love for us...their creation...only a fool would turn away.
0,177,22,JACKSON,"Just because the Ori know more than we do, doesn't make them gods...they are beings who were once like you and me...but they evolved...they learned of humanities potential...eventually over time they used that knowledge to shed their physical bodies and live as energy on another *raises hand* higher plane of existence."
0,177,22,VALA,*mutters to Mitchell* which side is he on?
0,177,22,PRIOR,you are all children of the Ori! But you've been raised by evil...the true nature of the universe has been kept from you by powers that would have you stray from the path of origin...it is time to open your eyes...let origin show you the way.
0,177,22,JACKSON,no...you're right...*walks* maybe hoarding the knowledge is wrong. Or maybe its not...maybe learning for yourself is part of the journey to enlightenment. But killing someone for not worshipping you...regardless of your power. Is wrong. Very wrong. Knowledge is power...but how you use that power defines whether you are good...or evil.
0,177,22,PRIOR,The choice is yours.
0,177,22,THATCHNER,Give us another chance I beg you. Please...spare us all
0,177,22,PRIOR,*puts hands on Thatchners head* Believe in the power of the ori...or be laid down in the dust *smirks at Vala*
0,177,23,AZDAK,Escort the prisoner back to the cell...
0,177,23,JACKSON,wait...
0,177,23,AZDAK,we're done with the Maldarran...we must vote now on her punishment and...discuss other issues...we now face...
0,177,23,JACKSON,waAzdak...I know what the Ori seem to be offering you might sound very tempting...
0,177,23,AZDAK,"We are poverty stricken, as a society we may not be able to survive much longer...we thought our god *waves at Vala* would provide for us. Why should we reject the knowledge and education to better ourselves...?"
0,177,23,JACKSON,But you can have all that without giving up your freedom. Don't you see how wrong it is to enforce belief by threatening your people with their very lives?
0,177,23,AZDAK,As the Ori said...would we not be ignorant and deserving of punishment for failing to see the plain truth before us? *looks at Vala shaking head* Leave us...we shall deliberate.
0,177,24,LANDRY,Comfortable where you're living?
0,177,24,LAM,I kind of like the place I'm renting in Cimarron hills
0,177,24,LANDRY,that's nice... you ought to buy.
0,177,24,LAM,well...just wait and see...I don't know how long I'm going to be here...so
0,177,24,LANDRY,"*nods, shifts* how's your mother?"
0,177,24,LAM,why don't you call her and find out yourself? *eats*
0,177,24,LANDRY,why does everything have to be so hostile? I'm trying. To tell you the truth I don't really know where to start...
0,177,24,LAM,start what? The long road back to happily ever after?
0,177,24,LANDRY,I had a job to do.
0,177,24,LAM,as I do. Now I though this was suppose to be a professional meeting about my staff? That's why I'm here.
0,177,24,LANDRY,excuse me. *gets up leaves*
0,177,26,VALA,You need to work on your anti-Ori speech...that prior almost had me believing...well not so much believing as willing to say I believe...
0,177,26,JACKSON,I know...
0,177,26,VALA,you are asking people to stand up and put their lives on the line...
0,177,26,JACKSON,I really believe it's the only way we're gonna have to defend ourselves against them...
0,177,26,VALA,we could try shooting them...*he grins* you said the priors are human...right? A few well aimed shots might...at least get there attention.
