Season,Episode,Scene,Character,Line
0,138,74,TYNAN,"For what purpose? Hmm? Sharing technology? Living in harmony? All lies. The Serrakin are seizing control or our world, piece by piece. Taking power and opportunity away from pure-blood Humans. Polluting our race by cross breeding. Weakening it by design. Don't you see? The Serrakin are no better than the Goa'uld."
0,138,74,EAMON,"This is insane, Tynan. Our society was built by both races...for the good of all Hebridians."
0,138,74,TYNAN,Is that why the Serrakin hold all the highest positions and Humans are treated like second class citizens?
0,138,74,EAMON,That's not true...when Hagan finds out about this...
0,138,74,TYNAN,"Hagan...is one of the primary architects of Human oppression on this planet. No, the winner of the Loop of Kon Garat will be a pure- blooded Human and that is merely the first step."
0,138,74,EAMON,You're just mad because...you've been passed over for advancement three times.
0,138,74,TYNAN,You think I'm the only one? There are enough of us to make a difference.
0,138,74,EAMON,"Has it occurred to you that...maybe the reason you've been passed over...so may times is not because you're a Human, but...because you're a moron?"
0,138,74,TYNAN,I am doing this to save my kind from the likes of you.
0,138,75,EAMON,I guess not.
0,138,76,HADRAIG,"Welcome back to TCNN's continuing exclusive coverage of the Loop of Kon Garat. Now, we have some startling developments to relate. Apparently, Warrick and the Earthling, Samantha Carter, have re-entered the race with a vengeance and are now pulling into a close third position. Coyle, what does this mean for Muirios?"
0,138,76,BORON,"Well, he's had a commanding lead for the bulk of the competition, but he's gotta be wondering what Warrick's got on board that allowed him to make up that kind of distance so fast."
0,138,76,HADRAIG,"Well, Coyle, perhaps he's using Ion Pro, a new engine additive from Tech Con Propulsion Systems."
0,138,76,BORON,"Yes, perhaps."
0,138,76,HADRAIG,"Ion Pro is guaranteed to improve drive performance, no matter what class ship you fly. Whether you're competing in the Loop of Kon Garat or just taking the kids to school, use Ion Pro in your power source. Ion Pro, from Tech Con Propulsion Systems: Your system wide experts in Ion drive technology."
0,138,77,RECEPTIONIST,"I'm sorry, I can't let you inside the complex without clearance."
0,138,77,JACKSON,We're looking for people we think are inside the building.
0,138,77,RECEPTIONIST,"If you give me their names, I can check and see if they're here."
0,138,77,JACKSON,Okay...one of them is named...
0,138,77,O'NEILL,Eamon.
0,138,77,JACKSON,Eamon.
0,138,77,RECEPTIONIST,"And his cousin, Murray?"
0,138,77,O'NEILL,Murray! Yes...that's them.
0,138,77,RECEPTIONIST,Yes...they're here.
0,138,77,JACKSON,"Good, can we go inside now?"
0,138,77,RECEPTIONIST,No.
0,138,77,O'NEILL,"All right...here's what I'd like you to do. Pick up that phone, call mister...whoever runs this place..."
0,138,77,JACKSON,Hagan.
0,138,77,O'NEILL,Hagan...
0,138,77,RECEPTIONIST,"I'm sorry, but I just can't..."
0,138,77,O'NEILL,We're old friends. Tell him Mr. Man-who-has-the-Stargate is here to see him. He'll understand.
0,138,77,JACKSON,Stargate.
0,138,77,O'NEILL,Go ahead...buttons...phone...
0,138,77,RECEPTIONIST,"Mr. Hagan, please."
0,138,77,O'NEILL,Nice.
0,138,78,EAMON,"What are you going to do, Tynan? He's an alien from another planet. His people are going to miss him."
0,138,79,MUIRIOS,"Tynan, respond."
0,138,79,TYNAN,"What is it, Muirios?"
0,138,79,MUIRIOS,It's the Seberus. Warrick is still in the race. He's gaining on my position.
0,138,80,WARRICK,Hard left!
0,138,81,JARLATH,What was that? You said left!
0,138,81,WARRICK,"Oh, did I? Sorry."
0,138,81,JARLATH,This is a waste of time! We don't have a chance! You're just gonna get us killed!
0,138,81,CARTER AND WARRICK,Shut up!
0,138,82,MUIRIOS,"Well, how did this happen? You said the Seberus would be disabled. That I was guaranteed to win."
0,138,83,TYNAN,"You will win, Muirios. Just focus on what you have to do. I'll take care of the Seberus. This is Tynan calling the Seberus. I know you can hear me."
0,138,83,WARRICK,"What do you want, Tynan?"
0,138,83,TYNAN,"I only intended to disable your ship, but your stubbornness as forced my hand. I have your brother and one of the visitors from Earth. So, drop out of the race...now."
0,138,85,HAGAN,Dr. Jackson...Colonel O'Neill... Sorry to keep you waiting. It's so nice to see you again. What can I do for you?
0,138,85,JACKSON,"Uhm, we think a...member of you group might, somehow, be lost...inside your building...with, uh, with one of your employees."
0,138,85,HAGAN,Lost? That seems unlikely.
0,138,85,O'NEILL,Well...you've gotta know the guy.
0,138,85,HAGAN,Of course...come with me.
0,138,86,WARRICK,We were gaining on them. We had a chance.
0,138,87,JARLATH,You're going to let a little thing like your brother's life stop you from winning the race?
0,138,87,CARTER AND WARRICK,Shut up.
0,138,88,TYNAN,Muirios...La'el Montrose is gaining on you.
0,138,88,MUIRIOS,"Yes, I know. You were supposed to take care of her."
0,138,88,TYNAN,I thought I did. She must have overcome the problem. Lose her.
0,138,88,MUIRIOS,I'm trying.
0,138,88,TYNAN,Try harder. Do whatever you have to.
0,138,89,TYNAN,Get rid of them. Take them away.
0,138,90,HAGAN,"Hello, Del."
0,138,90,TYNAN,Mr. Hagan...
0,138,91,JACKSON,Nice outfit. You guys okay?
0,138,91,TEAL'C,Indeed.
0,138,91,O'NEILL,"How many times have I told you, don't get caught by the bad guys?"
0,138,91,HAGAN,"How could you do this, Del?"
0,138,91,TEAL'C,He claims he was protecting his people from a Serrakin conspiracy to enslave the Humans of this world.
0,138,91,TYNAN,I did what I had to. You're kind are a disease.
0,138,91,EAMON,"The only disease here is greed. If he was protecting anything, it's a deal he made with Muirios. Which, I suspect, was quite lucrative."
0,138,91,HAGAN,The reason you've been passed over for advancement is because you've been under investigation for corruption for over a year. We couldn't prove anything until now.
0,138,91,TYNAN,I intend to file a protest with the employment council.
0,138,91,HAGAN,"Employment is the least of your worries, right now, Del."
0,138,92,EAMON,"Warrick, Major Carter...It's Eamon. Are you there?"
0,138,92,WARRICK,"Eamon, are you all right?"
0,138,92,EAMON,Teal'c and I are both safe. Now get back in the race...and win...if you can.
0,138,93,JARLATH,You must be out of your mind!
0,138,93,WARRICK,"Do not say a word. Major, give me all you've got."
0,138,93,CARTER,"Max power...Warrick, I hate to say it, but Jarlath might be right. Muirios has too big a lead. We'll never catch him. He cheated. I can't believe they'll still let him take first prize."
0,138,93,WARRICK,Unless we can keep Muirios from crossing the finish line first.
0,138,93,CARTER,How can we do that?
0,138,93,JARLATH,"Oh, that's easy. Just...get me close."
0,138,93,WARRICK,The closest we will get is when the double back past us after the final turn.
0,138,93,JARLATH,It'll have to do.
0,138,94,CARTER,What are you doing?
0,138,94,JARLATH,Re-routing the conduit from your fancy power device and doubling it back through the communications array.
0,138,94,CARTER,Why? So we can ask him to lose?
0,138,94,JARLATH,"Humorous. More like tell him. This will allow us to send a blast transmission. If my aim is correct, it'll temporarily freeze the command controls on Muirios' ship."
0,138,94,WARRICK,You are even crazier than I thought.
0,138,94,JARLATH,Never was much of a pilot. But weapons? It's an art.
0,138,94,WARRICK,They're coming around the final turn.
0,138,95,CARTER,He's trying to take out La'el's ship.
0,138,95,JARLATH,I don't think so.
0,138,96,WARRICK,Well done.
0,138,96,JARLATH,Ah...don't make me sick.
0,138,97,HADRAIG,Unbelievable! What a finish! La'el Montrose has won the Loop of Kon Garat! What happened to Muirios?
0,138,97,BORON,It was his race to lost and he lost it. It looks like some kind of beam weapon caused his ship's power to fail.
0,138,97,HADRAIG,Opening the door for La'el Montrose to take it all. You have got to love that there are no rules in this race.
0,138,97,BORON,"It's what makes this competition so special, Ardal. I must say, in all my years, I haven't seen anything like it."
0,138,97,HADRAIG,"Well, you must be particularly surprised, since you picked Muirios to win."
0,138,97,BORON,"Yes, I was wrong about that."
0,138,97,HADRAIG,"And you also said that Warrick wouldn't be in contention, and yet he came very close to finishing this race."
0,138,97,BORON,"Yes, I was wrong about that too."
0,138,97,HADRAIG,Any predictions for next year?
0,138,97,BORON,"Well, I'd rather not say..."
0,138,98,HADRAIG,"All right, then. We'll be right back with post-race interviews after a word from our sponsor: Corso's Temporal Eatery - where your whole family can eat what they want, when they want. Part of the Tech Con Group family of restaurants."
0,138,99,WARRICK,Sorry we did not win.
0,138,99,CARTER,It was still worth it.
0,138,101,CARTER,Hey...
0,138,101,JACKSON,Hey.
0,138,101,CARTER,I just hear from Warrick. The winner of the race hired him as co-pilot on her new contract with Tech Con.
0,138,101,JACKSON,That's great.
0,138,101,CARTER,Yeah. He sounded really happy.
0,138,101,JACKSON,You don't.
0,138,101,CARTER,I'm fine.
0,138,101,JACKSON,You've still got that ion drive to study.
0,138,101,CARTER,I know...very cool.
0,138,101,JACKSON,You're just sore that you lost.
0,138,101,CARTER,"Well, come on. It wasn't fair...bunch of cheaters."
0,138,102,JACKSON,"So, whatcha gonna do?"
0,138,102,CARTER,Next year...I'm gonna kick butt.
