Season,Episode,Scene,Character,Line
0,177,26,JACKSON,well...you study enough religions you find that killing the missionaries doesn't combat the overall philosophy.
0,177,26,VALA,The problem is that what the priors are offering sounds quite good...until you get to the whole prostrating and burning people alive bits...
0,177,26,JACKSON,There's that...and I don't think any of us have read the real fine print yet.
0,177,26,VALA,Meaning?
0,177,26,JACKSON,"Well...I personally know without a doubt, the priors are bad..."
0,177,26,VALA,So creepy...
0,177,26,JACKSON,And...believe or die is an archaic moral standing... No the Ori are wrong for doing what they're doing but the part I haven't figured out yet...the part that's really bothering me is...why they're doing it? I mean what do they care if people worship them or not?
0,177,27,AZDAK,We have decided to spare your life...*Both Vala and Jackson sigh in relief*
0,177,27,VALA,Really? Thank you.
0,177,27,AZDAK,Your punishment...will be imprisonment for the rest of your life...
0,177,27,VALA,What? Azdak...after everything we've been through *waves between them*...together
0,177,27,AZDAK,you made me rub your feet
0,177,28,VALA,Weren't you justly rewarded? Anyway the odd massage here and there hardly warrants life imprisonment...
0,177,28,AZDAK,You lied and abused the people of this planet.
0,177,28,JACKSON,What about the prior?
0,177,28,VALA,Wait a minute...we're not done with me yet. *hits Jackson again* AZDAK: Yes we are. As for the Prior the settlement is divided. Many believe the Ori are worthy of our devotion.
0,177,28,JACKSON,and you?
0,177,29,MAN,Thatchner has fallen ill.
0,177,29,JACKSON,that's the man the prior healed...
0,177,29,AZDAK,yes
0,177,29,MAN,Please hurry....we fear he may be close to death
0,177,29,JACKSON,*Azdak moves to go* wait Azdak......um...maybe we can help.
0,177,30,THATCHNER,I do not want you near me.
0,177,30,VALA,Take it easy.
0,177,30,JACKSON,Its ok....she's not gonna hurt him.
0,177,31,VALA,there. *she stops it* how do you feel now?
0,177,31,THATCHNER,What have you done to me?
0,177,31,VALA,Hmm...*grins* making people feel good is a natural talent of mine
0,177,31,JACKSON,*bends down helping Thatchner* can you sit up?
0,177,31,THATCHNER,I do not understand. How did she do it?
0,177,31,JACKSON,*takes healing device* well...this is a tool. Like a hammer or a shovel just a lot more complicated. Just because you don't understand something at first does not mean it's the magic of the gods.
0,177,32,AZDAK,You think...that if we are united and tell this prior that we will not heed his word he will merely go away and leave us alone?
0,177,32,JACKSON,"Well I wish I could say for sure what would happen, all I know is you have to make a stand."
0,177,32,MITCHELL,Whatever happens we'll be here to back you up.
0,177,32,JACKSON,But ultimately it's gonna be up to you and your people.
0,177,32,AZDAK,*stops turns to Vala* in exchange for saving Thatchners life I have decided to reopen the issue of your life imprisonment...
0,177,32,VALA,Thank you. I have to admit it did make me feel rather good.
0,177,32,JACKSON,I'm sure you thought there might be a reward...
0,177,32,VALA,That's not what I did it *Jackson gives her a disbelieving nod*
0,177,32,AZDAK,Speaking of rewards...the entirety of your property will be kept here as payment for your crimes.
0,177,32,VALA,"Now hang on a minute...*Azdak almost faints they grab him, pulling him upright*"
0,177,32,JACKSON,You alright?
0,177,32,AZDAK,yeah yes... its just been a long day.
0,177,32,MAN,*runs up to them* Azdak! You must come quickly
0,177,32,AZDAK,What is it?
0,177,32,MAN,Many have fallen ill.
0,177,34,AZDAK,*sits up* Thank you...you are truly blessed...
0,177,34,VALA,Oh I don't know about that...I'm just doing the best that I can...
0,177,34,AZDAK,How many have fallen ill?
0,177,34,VALA,I've lost count...but it's a lot
0,177,35,JACKSON,Well whatever this thing is it's spreading like wild fire... come on we need you over here...*leaves*
0,177,35,VALA,We'll talk about my treasure later *Follows Jackson*
0,177,36,MITCHELL,"We're doing our best to quarantine the sick, Vala's using the healing device...to cure them as they come in...but they're piling up pretty quick..."
0,177,36,LAM,Symptoms?
0,177,36,MITCHELL,"Weakness, high fever...chest and stomach pains...um...they have trouble breathing...some of the extreme cases have gone into shock before Vala can even get to them"
0,177,37,MITCHELL,Oh...I'd...I'd say we know the source...
0,177,37,LANDRY,Looks like these priors want to show us they're gonna play hardball
0,177,37,MITCHELL,Well they're definitely trying to establish some credibility sir.
0,177,37,LAM,how are you and you're team colonel.
0,177,37,MITCHELL,yeah we're fine...but I reckon we could use some back up
0,177,37,LANDRY,On the way colonel.
0,177,37,MITCHELL,Thank you sir.
0,177,38,JACKSON,You alright? *Sits next to her*
0,177,38,VALA,no.
0,177,38,JACKSON,you can do this
0,177,38,VALA,I'm not so sure.
0,177,38,JACKSON,Look I know using that hand device must be taking a lot out of you but we really...really need your help right now
0,177,38,VALA,Each one is getting harder...Each time it takes longer and they keep coming I don't think I can save this whole village Daniel
0,177,38,JACKSON,You have to keep trying...
0,177,38,MITCHELL,Jackson we have a problem here...
0,177,38,JACKSON,*grabs radio* Give me a minute
0,177,38,MITCHELL,Now please...
0,177,40,JACKSON,He was just fine.
0,177,40,MITCHELL,Well he's not fine now.
0,177,40,VALA,*drops down beside Azdak* I healed him...*looks at Jackson* if they can get re-infected this will never end...
0,177,40,AZDAK,We must give in...they are too powerful
0,177,40,VALA,No...*she uses the healing device on him* its ok...I'm here.
0,177,41,LANDRY,Caroline
0,177,41,LAM,I'm chief medical officer on this base. Its my call who goes on this mission. Given my work with the CDC infectious disease is my specialty. *stops* I am easily the most qualified for this.
0,177,41,LANDRY,I know. I'm your dad. Just came by to wish you luck and be careful
0,177,41,LAM,thank you. I will. *heads off*
0,177,42,JACKSON,"Hang in there. Don't give up yet. *looks over at Vala, who is healing a woman, shaking her head*"
0,177,42,MITCHELL,"Hey...*spotting Lam, walks over, he looks a little hot...* thanks for coming..."
0,177,42,LAM,This is worse than I thought
0,177,42,MITCHELL,Yeah...they're falling pretty fast
0,177,42,LAM,we're gonna need a place to work.
0,177,42,MITCHELL,"*nods, points* this way."
0,177,43,JACKSON,*quietly* what?
0,177,43,VALA,this *holds up healing device* is not working anymore...*hands it to him* I'm sorry
0,177,43,JACKSON,*sighs* you have to keep trying...I mean...at least put on a show keep their hopes up...we know you can do that
0,177,43,VALA,"see this is exactly why I don't even think about trying to help people. *jumps* I'm terrible at it, because of me...these poor souls are either gonna die horribly or they're gonna give into the prior in the hopes that he'll heal them"
0,177,43,JACKSON,*snaps quietly* that's not because of you!
0,177,43,VALA,I cannot make them better! And if I hadn't have been so worried about my precious treasure I would never have opened my big fat mouth and we never would have come here.
0,177,43,JACKSON,Then these people would still have to either convert to origin or face the consequences. And that's a dilemma the rest of our galaxy is going to have to worry about.
0,177,43,LAM,*Walks over to them * May I speak with you?
0,177,44,LAM,"I've pretty much ruled out bacterial infection at this point I'm treating with an antiviral cocktail, we're just gonna have to wait and see"
0,177,44,JACKSON,any idea why the hand device seems to have lost its effectiveness?
0,177,44,LAM,*they stop* First I'd have to understand even remotely how that thing works. I do know its not unheard of for viruses to mutate and become immune to whatever's trying to attack it
0,177,44,JACKSON,alright...I don't know if this helps or not but we know the ancients were almost wiped out by a similar plague *Lam nods* I'm just bringing it up in case there's something in the research that's already been done.
0,177,44,VALA,You think the Ori gave it to them? *he shrugs*
0,177,44,LAM,I am aware that sg-1 was infected with a virus and then cured by an ancient found frozen down in Antarctica. Now...the symptoms and rate of progression here...are remarkably similar.
0,177,44,TEAL'C,Do you have any hypotheses as to why we have not been affected?
0,177,44,LAM,No...we're still looking at your blood work...excuse me *she leaves Teal'c follows*
0,177,44,VALA,*to Jackson * feel my forehead am I hot? Hotter than usual *takes his hand* well *puts it on her head* you know what I mean...
0,177,45,LAM,I'm sorry...I'm sure you know how much I wanted to walk in here and solve this.
0,177,45,LANDRY,Hey you wanted to be a doctor
0,177,45,LAM,I've seen some bad situations before but nothing like this...
0,177,45,LANDRY,And based on that comparison what's that prognosis?
0,177,45,LAM,If we don't make a big breakthrough really soon...these people are going to need a miracle
0,177,45,NURSE,Dr Lam. You're need immediately
0,177,45,LAM,I have to go. Lam out.
0,177,46,VALA,This is bad right
0,177,46,LAM,The virus is shutting down his internal organs. He can't process toxins within his own system...he's essentially being poisoned to death.
0,177,46,VALA,Can't you give him more medicine
0,177,46,LAM,As it is this may be the virus bouncing back against treatment... I hate having to say this...but there's nothing I can do.
0,177,48,LAM,"Time of death. 14 hours 18 minutes after preliminary symptoms were first noted. *Its Azdak, they cover his head* remove the body and prep him for autopsy. *heads off*"
0,177,48,VALA,*stops nurse* can I have a minute with him first?
0,177,49,JACKSON,This is the first. not the last. I've got to get back to Colonel Mitchell.
0,177,50,JACKSON,You did everything you could.
0,177,50,THATCHNER,
0,177,50,VALA,You go ahead Daniel. *he heads off*
0,177,51,THATCHNER,Please you must save us. Forgive those blinded by ignorance. People are dieing. Our children are dieing. They will believe. They do believe.
0,177,51,PRIOR,Still...not all of you. *looks beyond him*
0,177,51,THATCHNER,*Jackson and Teal'c walk over* they are not of us. They do not speak for us.
0,177,51,JACKSON,Why are you doing this?
0,177,51,PRIOR,From the smallest seeds of doubt springs forth a mighty poisonous tree of evil.
0,177,51,JACKSON,Yeah alright. Cut the crap. This is my fault alright. I'm the one who told these people that if they didn't bow down to you... bow down to the ori. You might just give up and go away. Well I was wrong. I understand now. You don't have to kill them to prove a point to me.
0,177,51,PRIOR,Do you truly understand?
0,177,51,JACKSON,I understand this isn't about you and me.
0,177,51,PRIOR,it is about all the children of the Ori.
0,177,51,VALA,"Enough. *she walks up next to Jackson, holding P-90* heal these people now."
0,177,51,JACKSON,Vala...
0,177,51,VALA,No Daniel I've had it with the Ori I think its time we sent them a message. Or will you heal them
0,177,51,PRIOR,Only their faith can heal them now.
0,177,51,VALA,"Then you are useless to us *pulls p-90 up firing at prior, the bullets stop just short of his body and drop to the ground*"
0,177,51,THATCHNER,Stop at once. Please do not let their evil deeds doom us. *he kneels* we all bow to the power of the Ori. *the other follow and Bow too*
0,177,51,PRIOR,Hallowed are the Ori
0,177,51,CROWD,Hallowed are the Ori
0,177,52,LAM,Colonel.
0,177,52,MITCHELL,Ugh...wow. Have you got a couple of aspirin?
0,177,52,MALE NURSE,*runs in* Dr Lam!
0,177,52,LAM,*waves him off* how are you feeling.
0,177,52,MITCHELL,Tingly...how about we pretend I didn't say that
0,177,52,LAM,Ok...you hang on...and I'll be right back. *She and male nurse run off*
0,177,52,MITCHELL,Hey what did I miss?
0,177,53,LAM,Oh my god.
0,177,53,MALE NURSE,That's not all. *points*
0,177,55,PRIOR,"Tell others what you have seen today. *he leaves, the crowd bowing to him*"
