Season,Episode,Scene,Character,Line
0,24,60,RESIDENT,"Again, we thank you; you have given us a whole new world of beauty and future experiences."
0,24,60,JACK,"Well you've still got a lot of work to do, but we'll send along some supplies to get you started."
0,24,60,GAMEKEEPER,They are ruining everything. Do you know they are actually picking the flowers?
0,24,60,JACK,"This is real this time, isn't it?"
0,24,61,GAMEKEEPER,"Do not pull that! You are ruining the garden! I told you they will ruin everything - first the garden, next the entire planet!"
0,24,61,JACK AND DANIEL,It's real.
0,24,61,GAMEKEEPER,You are ruining the garden!
0,24,61,JACK,Thank you ma'am.
