Season,Episode,Scene,Character,Line
0,31,27,GARSHAW,I'm afraid we have made our decision. We have decided not to accept your request for an alliance.
0,31,27,CORDESH,Therefore you shall be our guests until such time as we decide to move to another planet.
0,31,27,JACK,What?
0,31,27,GARSHAW,"I'm sure you understand with your knowledge of this planet, you have become a security risk. We cannot allow you to leave until we have moved somewhere else that you do not know about."
0,31,27,DANIEL,"Well surely as Tok'ra you're more compassionate than that? Captain Carter's father is dying, I mean at least let her go."
0,31,27,CORDESH,She is the highest risk of all. She contains the memory of Jolinar of Malkshur.
0,31,27,TEAL'C,We are not the only ones who have knowledge of this planet. Those we left behind on the Tau'ri also possess this knowledge.
0,31,27,JACK,As evidenced by our friends here.
0,31,27,GARSHAW,It is our wish that your lack of return will convince them that we are Goa'uld and not Tok'ra.
0,31,27,DANIEL,You want them to think that we're dead.
0,31,27,JACK,Well that kinda sucks.
0,31,27,GARSHAW,I'm sorry. We will try to make you as comfortable as possible.
