Season,Episode,Scene,Character,Line
0,86,0,STARGATE SG1,Episode 422
0,86,0,"""EXODUS""","By Paul Mullie & Joseph Mallozzi Previously on SG1- Clips from Crossroads, The Serpents Venom, Double Jeopardy"
0,86,1,TANITH,What is happening?
0,86,1,TOK'RA WOMAN1,Defence systems picked up a mothership entering orbit.
0,86,1,TANITH,We must evacuate immediately.
0,86,1,TOK'RA WOMAN1,We have expecting it.
0,86,2,O'NEILL,Hey kids! We're not parked in a red zone are we?
0,86,5,TEAL'C,Tanith was surprised to see us.
0,86,5,JACOB,Uh huh. We didn't want to give him any warning.
0,86,5,O'NEILL,Doesn't suspect you're on to him?
0,86,5,JACOB,Not that we know of. We'll see soon enough.
0,86,5,TEAL'C,Of what do you speak?
0,86,5,JACOB,"Well, thanks to the mothership you're so graciously lending us."
0,86,5,O'NEILL,Not me. Hammond. It was an order remember?
0,86,5,JACOB,"Well anyway, we'll be able to move the Stargate to a new planet not currently on the Goa'uld map. We'll finally be able to ensure the security of a more permanent Tok'ra base. As useful as Tanith has been in relaying false information to Apophis, we can't afford to take him with us."
0,86,5,TEAL'C,What will become of him?
0,86,5,JACOB,We have a little surprise planned. Shall we?
0,86,6,TOK'RA WOMAN1,Colonel O'Neill. Teal'c. Allow me to welcome you and your team back to Vorash. High Counsellor Per'sus sends his greetings.
0,86,6,O'NEILL,Always a pleasure.
0,86,6,TANITH,"I must say Colonel, I was most intrigued by your means of arrival."
0,86,6,O'NEILL,"Yeah, it's a sweet ride. A little rusty but it's still got zip."
0,86,6,TANITH,How exactly did a Goa'uld mothership come into your possession?
0,86,6,O'NEILL,Well it was kind of a trade deal.
0,86,6,TANITH,How so?
0,86,6,O'NEILL,Chronus gave us his ship and he got what was coming to him.
0,86,6,TANITH,Really? Chronus is dead.
0,86,6,JACOB/SELMAK,"Now that we have access to a mothership, we will be able to move our people and our Stargate as well and thereby establish a completely new and secure base."
0,86,6,TANITH,I don't understand. Why have I been excluded from such important information?
0,86,6,TEAL'C,The Tok'ra did not wish Apophis to be informed.
0,86,6,JACOB/SELMAK,We've been aware of your duplicity from the beginning. You deceived and then murdered the Jaffa Shau'nac. You took the host Hebron and you've been acting as a spy amongst us ever since.
0,86,6,TEAL'C,You have been used to channel disinformation to Apophis. He will most be most displeased when he learns the truth.
0,86,6,TANITH,This is absurd.
0,86,7,TANITH,You will never escape. The System Lords will hunt you down to the ends of the galaxy.
0,86,8,O'NEILL,That guy is a living cliché.
0,86,9,TEAL'C,I wish to speak to the prisoner.
0,86,10,TANITH,I wasn't aware I was allowed guests. How kind of you to come visit me Teal'c.
0,86,10,TEAL'C,My presence here is not motivated by kindness. I am here to deliver your sentence as decreed by the Tok'ra High Council.
0,86,10,TANITH,Death I suppose?
0,86,10,TEAL'C,"You are to be extracted from the host Hebron and left behind here on Vorash. If you are fortunate, you will die before Apophis discovers how you have been used by the Tok'ra."
0,86,10,TANITH,I am sure you would like to kill me with your bare hands as I did to your beloved Shau'nac. You of all would appreciate how much more satisfying it is to see the fear and pain in the eyes of your victim as they die.
0,86,10,TEAL'C,"You took great pleasure in the murder of Shau'nac. But you must understand the price you paid. While Apophis was being diverted by your unwitting deception the Tok'ra were able to move freely through Goa'uld territory untouched. Rescuing stranded agents, freeing captured allies. Hundreds of lives were saved by the false information you spread. The Tok'ra owe you a debt of gratitude Tanith. Were it not for the relative ease with which you allowed yourself to be manipulated, Apophis may have eliminated the Tok'ra."
0,86,10,TANITH,All they have done is win a respite. Inevitabley the Tok'ra/Tau'ri alliance will fall and so many others.
0,86,10,TEAL'C,"Not by any action of yours. I will watch you die like all of the other false God's whose demise I have witnessed. Sokar, Seth, Hathor, Heru'er, Chronus."
0,86,10,TANITH,I am sure they died with more honour than Shau'nac. She cried out for you like a baby weeps for it's mother as I slowly extinguished her life.
0,86,10,TEAL'C,"You are attempting to goad me into killing you, thereby avoiding the extraction process. I understand it to be excruciatingly painful for the symbiote."
0,86,10,TANITH,I am far more valuable to you alive than dead.
0,86,10,TEAL'C,The Tok'ra do not believe so and I am inclined to agree.
0,86,13,JACOB,"You'll have to take that to the secondary cargo hold, we need to room for the Stargate."
0,86,13,O'NEILL,Hey! Don't scuff the walls. I want this ship back the way we found it.
0,86,13,JACOB,We know Jack. I still don't think it's really necessary for you to be here.
0,86,13,O'NEILL,"Sorry, not letting her out of my sight."
0,86,13,JACOB,My mission is to oversee the relocation of the Tok'ra base. What's yours again?
0,86,13,O'NEILL,Protect Earth's big fat asset. We've got about a thousand engineers and scientists just drooling to go through this thing.
0,86,13,JACOB,You really think that's wise?
0,86,13,O'NEILL,Don't start with me Jake.
0,86,13,JACOB,Remember when you tried to retrofit a death glider?
0,86,13,O'NEILL,Yes I have that memory.
0,86,13,JACOB,This is a vastly more complicated piece of technology.
0,86,13,O'NEILL,Which is exactly why we're loaning it to you in exchange for flying lessons.
0,86,13,JACOB,You know what I mean. You should really leave the ship with us.
0,86,13,O'NEILL,Not a chance.
0,86,13,JACOB,"This is me talking Jack, Jacob not Selmak. You have no idea how dangerous this thing is."
0,86,13,O'NEILL,"Hey! We were smart enough to steal it in the first place, which is more than the Tok'ra have been able to do."
0,86,13,JACOB,We don't operate that way.
0,86,13,O'NEILL,"Well maybe it's time you took a more direct approach. The Tok'ra have been around for what, two thousand years? In all that time how many System Lords have you taken down?"
0,86,13,JACOB,"Oh yeah, things have certainly gotten better out here since you started killing Goa'ulds one by one. Lets examine the results, in each case more warlike Goa'ulds have stepped in to fill their place, there's more chaos than ever before. With the power Apophis now has we are on the brink of losing any chance of ever defeating the Goa'uld."
0,86,13,O'NEILL,At least we're doing something.
0,86,13,JACOB,"Well we're doing something as well, maybe our plan is a little more long term but at least we have one."
0,86,13,O'NEILL,What plan?
0,86,13,JACOB,Undermine the Goa'ulds individual power and keep them fighting amongst themselves until we have a way of eliminating them. Once and for all.
0,86,13,O'NEILL,Go on.
0,86,13,JACOB,We're working on it Jack.
0,86,15,TANITH,You think you can save my host Hebron by separating him from me? I will not allow you to kill me. Hebron's life is in my hands. If I am to die he will die with me.
0,86,16,TOK'RA GUARD1,The prisoner just collapsed.
0,86,17,TOK'RA WOMAN2,Lower the shield. Lower the shield! We cannot just stand by and allow him to kill the host.
0,86,18,TOK'RA GUARD1,He's already dead.
0,86,20,CARTER,We've finished loading the supplies onto the ship. It's time to start transporting your people up.
0,86,20,TOK'RA,We will begin immediately.
0,86,21,JACOB,It's Tanith. He's escaped.
0,86,25,TEAL'C,Tanith could not have escaped through the Stargate. It has been heavily guarded the entire time.
0,86,25,O'NEILL,"Yeah, what by the same guys who were guarding him in the first place? No offence."
0,86,25,TEAL'C,He is out here somewhere.
0,86,25,O'NEILL,Ahh well he's boned without water.
0,86,25,TEAL'C,The symbiote will sustain him for a considerable time.
0,86,25,O'NEILL,Big desert.
0,86,25,TEAL'C,I will continue looking.
0,86,25,O'NEILL,Keep in touch.
0,86,26,O'NEILL,So how do you guys know where to stand anyway?
0,86,28,DANIEL,Any sign of him?
0,86,28,O'NEILL,"Nope, he's still looking."
0,86,28,DANIEL,You guys have been up there for hours already.
0,86,28,O'NEILL,It's a jaffa revenge thing.
0,86,30,JACOB,It seems Tanith's been busy. We've received word from one of our operatives that Apophis has been given our location.
0,86,30,DANIEL,Guess he's trying to make up for the last few months.
0,86,30,JACOB,An attack fleet is being assembled.
0,86,30,O'NEILL,How long will it take him to get here?
0,86,30,JACOB,Less than a day.
0,86,30,DANIEL,We have to speed up the evacuation.
0,86,30,CARTER,We're gonna send them through the Gate.
0,86,30,O'NEILL,I thought we were gonna take `em on the ship?
0,86,30,JACOB,Sam and I have come up with a new plan.
0,86,30,CARTER,If it works we may be able to wipe out a significant part of Apophis' fleet in one shot. This is a sun that Vorash is orbiting. It's a regular main sequence star with a core temperature of about 15 million degrees and enough hydrogen to burn for another five billion years.
0,86,30,O'NEILL,Yeah?
0,86,30,JACOB,We wanna blow it up.
0,86,30,O'NEILL,Wow..
0,86,30,DANIEL,That's err.
0,86,30,O'NEILL/DANIEL,Ambitious.
0,86,30,CARTER,Every star is a delicate balance between the explosive force of the fusion going on in it's core which tends to want to blow it apart and the gravitational force of it's mass which tends to want to crush it into a little ball. Now if we could disrupt that balance by suddenly removing some of the star's mass we could create an artificial supernova. The blast wave would expand at nearly the speed of light. It would destroy everything in this system within a matter of minutes.
0,86,30,DANIEL,Err.. How are we supposed to remove some of the star's mass?
0,86,30,CARTER,"Well. err. this is going to sound a little crazy but we dial P3W 451, it's the planet where we encountered the black hole."
0,86,30,O'NEILL,Wow. That sounds a little crazy.
0,86,30,CARTER,Yeah.
0,86,30,JACOB,"We take the Stargate in the mothership and bring it as close to the sun as we can. Then we dial the black hole, enclose the Gate in a force field and jettison it."
0,86,30,CARTER,"The suns gravity will pull it in, the force field will disintegrate and stellar matter will be sucked through that wormhole like water through a fire hose."
0,86,30,JACOB,It's likely the Gate won't last long but we figure it'll be long enough.
0,86,30,DANIEL,"Excuse me, but wasn't the Gate on P3W 451 sucked into the black hole a long time ago?"
0,86,30,CARTER,Not necessarily. That planet was probably ripped to pieces but it could take years for that matter to spiral into the event horizon especially given the time distortion.
0,86,30,JACOB,"Either way we'll know as soon as we try to dial out. If we can't make a connection, we abort the plan and get the hell out of there."
0,86,30,O'NEILL,"Well, let me think about this a moment."
0,86,30,JACOB,"You're the one who wanted to take more direct measures Jack. The Council's already approved the plan. But it's your ship, which means it's your call."
0,86,30,O'NEILL,Still thinking.
0,86,30,CARTER,"Sir, this solar system is completely abandoned and barren. Apophis' fleet is on the way. We may never have an opportunity like this again."
0,86,30,O'NEILL,Okay.
0,86,32,DANIEL,Hey Teal'c. I've been looking for you. There's been a change in plans.
0,86,32,TEAL'C,I have been informed of Major Carter's plans.
0,86,32,DANIEL,So you understand then that there's nowhere for Tanith to run? This whole planet is going to be incinerated.
0,86,32,TEAL'C,"If all goes according to plan, yes."
0,86,32,DANIEL,Well you don't think we can pull it off?
0,86,32,TEAL'C,I have great confidence in both Selmak and Major Carter.
0,86,32,DANIEL,But?
0,86,32,TEAL'C,Twice I have had the opportunity to avenge the murder of Shau'nac. Twice I have let Tanith slip through my grasp. I have failed Shau'nac.
0,86,32,DANIEL,That's not true. You let Tanith live so the Tok'ra could use him and it worked. And now we're about to take down Apophis and the largest Goa'uld fleet ever assembled.
0,86,32,TEAL'C,It will be a great victory.
0,86,32,DANIEL,That's right.
0,86,32,TEAL'C,And knowing what Apophis did to Sha're would you not trade it all for the opportunity to crush the life from his throat with your bare hands?
0,86,32,DANIEL,"Well, I'd be lying to you if I said I'd never thought about it but that doesn't mean I'd do it, given a more rational option."
0,86,32,TEAL'C,In the future I will not be capable of such restraint.
0,86,34,CARTER,The last of the Tok'ra have been evacuated and the Stargate's been loaded into the cargo bay. We're good to go.
0,86,35,O'NEILL,Oohh. Shotgun.
0,86,35,JACOB,Setting course for the sun. I'm picking up the fleet on long range scanners. At current speed they'll be here in 68 minutes.
0,86,35,CARTER,The timing has to be precise. Once we're close enough to the sun we'll slow to 5% light speed and release the gate. That should give us more than enough time to get away.
0,86,35,O'NEILL,How much advance warning is Apophis gonna have?
0,86,35,JACOB,They won't be able to detect the Gate on their screens and they won't know Vorash is deserted until they're in orbit. By then it will be too late.
0,86,37,JACOB (VOICEOVER),We're in position. Slowing to 5% light speed.
0,86,37,CARTER,Cargo bay's gravity generators at maximum. Initiating remote dialout sequence.
0,86,37,JACOB,Ready when you are.
0,86,37,CARTER,It worked. The Gate on P3W 451 is still active. Engaging force field.
0,86,37,O'NEILL,Summat wrong?
0,86,37,CARTER,No. I've just never blown up a star before.
0,86,37,O'NEILL,Well they say the first one's always the hardest. They say that.
0,86,37,CARTER,Opening the cargo bay doors. Releasing the clamps. And the Gate is away.
0,86,38,JACOB,Gate trajectory on course. Alright time to go. Prepare for hyperspeed.
0,86,39,DANIEL,What the hell's that?
0,86,40,O'NEILL,What the hell was that?
0,86,40,JACOB,"We're under attack. Teal'c, weapons."
0,86,40,TEAL'C,Shields are inoperative.
0,86,40,JACOB,"It can't be Apophis, it's too soon."
0,86,40,TEAL'C,Acquiring target. It is an alkesh. A goa'uld mid range bomber.
0,86,40,JACOB,It must have been cloaked.
0,86,40,TEAL'C,Weapons are charged. Returning fire.
0,86,40,JACOB,She's too quick. Here she comes again Teal'c.
0,86,40,O'NEILL,Jacob?
0,86,40,JACOB,We've lost main power. Hyperdrive is down. We're sitting ducks.
0,86,40,DANIEL,Why haven't they finished us off?
0,86,40,JACOB,"They took a direct hit, they might be just as damaged as we are."
0,86,40,O'NEILL,"Hey, whose `they' anyway?"
0,86,40,JACOB,I have no idea
0,86,40,TEAL'C,Tactical indicators are down.
0,86,40,O'NEILL,Weapons?
0,86,40,TEAL'C,Inoperable.
0,86,40,JACOB,I have to go check it out.
0,86,40,O'NEILL,Hey! Whoa! We've still got an enemy ship out there.
0,86,40,CARTER,"Sir, when that Gate reaches the sun.."
0,86,40,O'NEILL,It's not gonna make any difference if we get blown out of the sky.
0,86,40,JACOB,What do you want us to do Jack? We have no weapons or shields.
0,86,40,O'NEILL,Gliders. This ship's got gliders right?
0,86,40,JACOB,Of course.
0,86,40,O'NEILL,Teal'c.
0,86,41,TEAL'C,The alkesh has an significant advantage in both size and armaments.
0,86,41,O'NEILL,Hey nice pre-flight there.
0,86,41,TEAL'C,However we have superior maneouvrability.
0,86,41,O'NEILL,Alright there she is.
0,86,41,TEAL'C,Jacob was right. The ship appears to have been damaged.
0,86,41,O'NEILL,Let's put her out of misery. Powering weapons.
0,86,42,O'NEILL,What the hell?
0,86,42,TEAL'C,They appear to have repaired their engines.
0,86,43,JACOB,Jack? What's happening out there?
0,86,43,O'NEILL VOICEOVER,They're breaking off.
0,86,43,JACOB,So let them go.
0,86,44,TEAL'C,"O'Neill, the ship appears to be heading for Vorash."
0,86,44,O'NEILL,Ahh Teal'c?
0,86,44,TEAL'C,We must not allow Tanith to escape.
0,86,44,O'NEILL,Teal'c thinks the ship might be going to pick up Tanith.
0,86,44,JACOB,That makes sense Jack. He probably had his ship waiting in a nearby system to hold time. That's why they got here so fast.
0,86,44,O'NEILL,Yeah well seems we're going after him.
0,86,44,DANIEL,It's a jaffa revenge thing.
0,86,44,CARTER,"Sir, you only have a little more than an hour."
0,86,44,O'NEILL,"Ahh Carter relax. We'll be back in plenty of time. Right Teal'c, we'll be back in plenty of time? Buddy? Pal? Oh God."
0,86,45,JACOB,"Sam. I'm gonna need your help with the hyperdrive. Dr. Jackson, you have the pel'tac."
0,86,45,DANIEL,"Ahh what, what, what exactly does that mean?"
0,86,45,JACOB,We'll stay in touch.
0,86,46,TEAL'C,Target is in range.
0,86,46,O'NEILL,Weapons locked. Here we go.
0,86,50,O'NEILL,Pull up Teal'c. Teal'c pull up!
0,86,53,O'NEILL,"Mayday, mayday. We are SO going in."
0,86,53,DANIEL,"Jack can you hear me? Jack I'm not reading you, what's happening? Jack?"
0,86,54,JACOB,Main power's back on line. Weapons and shields are operational.
0,86,54,CARTER,What about the hyperdrive?
0,86,54,JACOB,The control circuit is fried. The engines themselves are fine but we'll have to re route through secondary systems.
0,86,54,CARTER,Well how long will that take?
0,86,54,JACOB,We'll have to move fast.
0,86,54,DANIEL VOICEOVER,Sam?
0,86,54,CARTER,Go ahead.
0,86,54,DANIEL,I just got a mayday from Jack.
0,86,54,CARTER,What's going on?
0,86,54,DANIEL,"I don't know, I lost the transmission."
0,86,54,CARTER,Hang on. We have to go back for them.
0,86,54,JACOB,We can't. Not now.
0,86,54,CARTER,Why not? We have sub light speed.
0,86,54,JACOB,I know but I'm the only one that can fly this ship and I have to stay here and make these repairs.
0,86,54,CARTER,Well I'll do them.
0,86,54,JACOB,Sam.
0,86,54,CARTER,We're not leaving them behind. You can talk me through it.
0,86,54,JACOB,Okay. You can start by pulling out the burnt crystals.
0,86,56,TEAL'C,The propulsion system and communication array have been damaged beyond repair.
0,86,56,O'NEILL,Ah that's good because according to my calculations we are roughly in the middle of nowhere. Give or take.
0,86,56,TEAL'C,"The cruiser was on its way to pick up Tanith. Therefore we cannot be far from the Tok'ra base. If we can make it there, Major Carter and Daniel Jackson can ring us aboard the mothership."
0,86,56,O'NEILL,You're assuming they're assuming we're alive and they're coming back for us of course.
0,86,56,TEAL'C,Care to make a wager O'Neill?
0,86,56,O'NEILL,On which part?
0,86,56,TEAL'C,I believe it is this way.
0,86,56,O'NEILL,This is SO the last time I help someone move.
0,86,58,JACOB,Good the tactical display came back on line.
0,86,58,DANIEL,"Yeah, I think we have a problem here. I figure that flashing wasn't good news, and the fact that in Goa'uld it says... Warning, Warning."
0,86,58,JACOB,It's Apophis. He's here. He's a little ahead of schedule. The other ship must have warned him to pick up the pace.
0,86,58,DANIEL,What are you doing?
0,86,58,JACOB,Retreating.
0,86,58,DANIEL,"Yeah, what about Jack and Teal'c?"
0,86,58,JACOB,"Apophis' ships are taking up attack positions around Vorash, he'd destroy us before we even got close. I'm not going to abandon them Daniel. We need to buy more time. If we move around behind the sun, the fleet won't spot us."
0,86,59,O'NEILL,"Ah this is a bad idea. I said that remember. Remember I said, General this is a bad idea."
0,86,59,TEAL'C,I remember O'Neill.
0,86,59,O'NEILL,"Let the Tok'ra get their own ship I said. They don't share with us, why should we share with them?"
0,86,59,TEAL'C,I remember.
0,86,59,O'NEILL,"Yep, that's what I said."
0,86,59,TEAL'C,How much time remains before the sun explodes O'Neill?
0,86,59,O'NEILL,"Huh, oh 45 minutes."
0,86,59,TEAL'C,Then at least we have prevented Tanith from escaping.
0,86,59,O'NEILL,"Yes, at least we have that."
0,86,61,JAFFA1,Apophis sends his greetings and bids you welcome upon his vessel. He is grateful for your service.
0,86,61,TANITH,There may still be one more thing for which he can be grateful.
0,86,62,CARTER VOICEOVER,"Okay, now what?"
0,86,62,JACOB,Replace the last two crystals. The whole panel should light up and you should hear a hum.
0,86,62,CARTER,Humming away. Hyperdrive's on line.
0,86,63,O'NEILL,"Yeah, should be around here somewhere."
0,86,63,TEAL'C,Indeed. The rings are centred here.
0,86,63,O'NEILL,"So, now what?"
0,86,66,JACOB,The Stargate just entered the sun.
0,86,66,CARTER,We only have 27 minutes before it goes supernova. Why aren't we heading back to Vorash?
0,86,66,JACOB,"Apophis is already there, there's no way we're gonna get near that planet."
0,86,66,CARTER,But we have to do something.
0,86,66,JACOB,"Apophis wants the Tok'ra, so let's give them to him."
0,86,67,APOPHIS,You are injured?
0,86,67,TANITH,I will be fine.
0,86,67,APOPHIS,Where are the Tok'ra?
0,86,67,TANITH,The attempt to stop their ship was thwarted however I have managed to procure a gift which will make the journey seem worthwhile.
0,86,67,APOPHIS,The shol'va. You have done well.
0,86,68,JACOB,Remote guidance engaged. Launching gliders.
0,86,70,JAFFA,Lord Apophis. Scanners have picked up a fleet of gliders moving out from behind the sun.
0,86,70,APOPHIS,Surround them.
0,86,70,JAFFA,The fleet is on course. They are heading out of the system. Speed increasing.
0,86,71,JACOB,He's taking the bait. The fleet is leaving Vorash.
0,86,72,JAFFA,"We are approaching the enemy ships. My Lord, there are no life signs, the ships are unmanned."
0,86,72,APOPHIS,A trick.
0,86,72,JAFFA,Sensors are picking up a ha'tak now approaching the planet.
0,86,73,JACOB,Less than 4 minutes before the sun begins to supernova.
0,86,74,DANIEL VOICEOVER,"Jack, come in. Jack, come in."
0,86,74,O'NEILL,"Yeah, I'm here. Hey, thanks for checking in."
0,86,74,DANIEL VOICEOVER,"Yeah, we had a little trouble avoiding Apophis' fleet. Are you in position to be ringed up?"
0,86,74,O'NEILL,"Yeah, I s'pose. I don't know."
0,86,74,DANIEL VOICEOVER,Jack if you're not in position.
0,86,74,O'NEILL,Daniel just get me the hell out of here will ya?
0,86,75,JACOB,We gotta get out of here.
0,86,75,CARTER,If my calculation were correct.
0,86,77,APOPHIS,Arm the weapons.
0,86,77,JAFFA,My Lord.
0,86,79,JACOB,Engaging hyperdrive.
0,86,81,CARTER,What just happened?
0,86,81,JACOB,We must have caught the tail end of the blast wave. It knocked us off course.
0,86,82,CARTER,Sir. Where's Teal'c?
0,86,82,O'NEILL,I'm not sure. I think he's dead.
0,86,82,JACOB,If Apophis has him.
0,86,82,CARTER,We have to go back.
0,86,82,JACOB,That may not be possible Sam. The navigational computer isn't recognising any of the star patterns. According to these readings we've travelled over 4 million light years.
0,86,82,CARTER,That's impossible.
0,86,82,JACOB,We're not even in our own galaxy anymore.
0,86,82,CARTER,Well the explosion must have somehow affected the subspace window created by the hyperdrive.
0,86,82,O'NEILL,"Wait a minute, what are you saying, we can't get back?"
0,86,82,JACOB,I don't know. The ship isn't normally capable of going so fast.
0,86,82,O'NEILL,It only took us a few seconds to get here.
0,86,82,JACOB,"Given our current position, and maximum hyperdrive speed, it's gonna take us 125 years to get back. Long range sensors are picking up another ship. It's Apophis.."
