Season,Episode,Scene,Character,Line
0,99,114,ELLIOT,"Haley's still alive, we need a medical team down here. I say again, Haley needs help in here."
0,99,115,ELLIOT,You've got to be kidding me.
0,99,115,HALEY,"You can put me down now, hero."
0,99,115,ELLIOT,You were in on it.
0,99,115,HALEY,How do you think I was able to show you nanobots if they don't really exist?
0,99,115,ELLIOT,I'm gonna kill you.
0,99,115,HALEY,You should have seen what they put me through.
0,99,116,HAMMOND,
0,99,116,ELLIOT,"Yes, sir."
0,99,116,HAMMOND,"After a few days rest, you're to report back to the SGC, where you will be assigned to SG17 under Major Mansfield."
0,99,116,O'NEILL,If you think I was tough on you.
0,99,116,ELLIOT,What about the rest of the team?
0,99,116,HAMMOND,They will be assigned to SG teams as positions become available down the road. But the first assignment is yours.
0,99,116,ELLIOT,"Yes, sir."
0,99,116,HAMMOND,"Congratulations, son."
0,99,116,O'NEILL,"Good job. Hey, you knew it was a test when you shot me, right?"
0,99,116,ELLIOT,"Well maybe, suspected."
0,99,116,O'NEILL,And you really think the test is over now?
